{
  "$schema": "http://json-schema.org/draft-04/schema#",
   "id": "http://localhost/api-doc/schemas/",
    "type": "array",
    "description": "The list of task.",
    "items": {
      "type": "object",
      "properties": {
         "_id": {
          "type": "string",
          "description": "ID of the task"
        },
        "title": {
          "type": "string",
          "description": "Task title"
        },
        "description" : {
          "type": "string",
          "description": "Task description"
        },
         "status" : {
          "type": "string",
           "description": "Task status. Possible value: `Pending`, `Completed`, ``"
        },
        "date": {
          "type": "string",
          "description": "Time to execute the task"
        },
        "is_important": {
          "type": "boolean",
          "description": "Indicate the task importance"
        },
        "user": {
          "type": "string",
          "description": "Id of the creator of the task"
        },
        "created_at": {
          "type": "string",
          "description": "Task creation date"
        },
        "updated_at": {
          "type": "string",
          "description": "Task update date"
        }
      },
     "required": [ "_id", "title", "description", "status", "date", "is_important", "user", "created_at", "updated_at" ]
    }
    
}