[
    {
      "_id": "5d31c351df1c9dfd93d25786",
      "title": "Test Application",
      "description": "QA testing on the whole application",
      "status": "Pending",
      "date": "2019-05-30 09:30:00",
      "is_important": true,
      "user": "5cee861d04d9f4214dc8dce6",
      "created_at": "2019-07-19 14:19:13.463",
      "updated_at": "2019-07-19 14:19:13.463"
    },
    {
      "_id": "5caa22a898eb5b14af3e93ec",
      "title": "Learn a Tutorial",
      "description": "Learn tutorial on microservice architectures",
      "status": "Completed",
      "date": "2019-05-30 09:30:00",
      "is_important": false,
      "user": "5cee861d04d9f4214dc8dce6",
      "created_at": "2019-07-19 14:19:13.463",
      "updated_at": "2019-07-19 14:19:13.463"
    }
]